user_input,retrieved_contexts,response,reference,context_precision,context_recall,faithfulness,answer_relevancy
Che cos'è un transformer?,"['An Introduction to Transformers\nRichard E. Turner\nDepartment of Engineering, University of Cambridge, UK\nMicrosoft Research, Cambridge, UK\nret26@cam.ac.uk\nAbstract. The transformer is a neural network component that can be used to learn useful represen-\ntations of sequences or sets of data-points [Vaswani et al., 2017]. The transformer has driven recent\nadvances in natural language processing [Devlin et al., 2019], computer vision [Dosovitskiy et al., 2021],\nand spatio-temporal modelling [Bi et al., 2022]. There are many introductions to transformers, but most\ndo not contain precise mathematical descriptions of the architecture and the intuitions behind the design', 'that is they specify a sparse graph connectivity\nstructure. Arguably, in this way transformers are\nmore general as they can use different graphs at\ndifferent layers in the transformer.\n16 This is also known as z-scoring in some fields\nand is related to whitening.\nFigure 4 shows multi-head self-attention schematically. Multi-head attention\ncomprises the following parametersθ = {Uq,h,Uk,h,Vh}H\nh=1 i.e. 3H matrices\nof sizeK×D, K×D, andD×D respectively.\nFigure 4:Multi-head self-attention appliesH self-\nattention operations in parallel and then linearly\nprojects theHD ×N dimensional output down to\nD ×N by applying a linear transform, implemented\nhere by theH matrices Vh.', 'test-time.\nFortunately, there is a neat way around this by enabling the transformer to\nsupport incremental updates whereby if you add a new token to an existing\nsequence, you do not change the representation for the old tokens. To make this\nproperty clear, I will define it mathematically: let the output of the incremental\ntransformer applied to the firstn words be denoted20\nX(n) = transformer-incremental(w1:n).\nThen the output of the incremental transformer when applied ton+ 1 words is\nX(n+1) = transformer-incremental(w1:n+1).\nIn the incremental transformerX(n) = X(n+1)\n1:D,1:n i.e. the representation of the\nold tokens has not changed by adding the new one. If we have this property\n6', 'Layer normalisation is also applied to the inputs of both the MHSA and the\nMLP. They are then stacked. This block can then be repeatedM times.\n3 Position encoding\nThe transformer treats the data as a set — if you permute the columns ofX(0)\n(i.e. re-order the tokens in the input sequence) you permute all the represen-\ntations throughout the networkX(m) in the same way. This is key for many\napplications since there may not be a natural way to order the original data into\na sequence of tokens. For example, there is no single ‘correct’ order to map\n5']","Un transformer è un componente di rete neurale utilizzato per apprendere rappresentazioni utili di sequenze o insiemi di dati. Ha avuto un impatto significativo in campi come l'elaborazione del linguaggio naturale, la visione artificiale e la modellazione spazio-temporale. La sua architettura include meccanismi come la multi-head self-attention, che applica operazioni di attenzione parallele e proietta i risultati attraverso trasformazioni lineari. Inoltre, il transformer può supportare aggiornamenti incrementali, mantenendo invariata la rappresentazione dei token precedenti quando si aggiungono nuovi token [source:Documents\transformers.pdf].",Un transformer è un'architettura di rete neurale introdotta nel 2017. Si basa sul meccanismo di attenzione che permette di dare al modello più peso alle parti più rilevanti di una sequenza.,0.9999999999,1.0,1.0,0.8291035296424932
Che cos'è una RNN?,"['Recurrent Neural Networks (RNNs):\nA gentle Introduction and Overview\nRobin M. Schmidt\nDepartment of Computer Science\nEberhard-Karls-University Tübingen\nTübingen, Germany\nrob.schmidt@student.uni-tuebingen.de\nAbstract\nState-of-the-art solutions in the areas of “Language Modelling & Generating Text”,\n“Speech Recognition”, “Generating Image Descriptions” or “Video Tagging” have\nbeen using Recurrent Neural Networks as the foundation for their approaches.\nUnderstanding the underlying concepts is therefore of tremendous importance if\nwe want to keep up with recent or upcoming publications in those areas. In this\nwork we give a short overview over some of the most important concepts in the', 'each Yt is a sequence element with order t. At each time step the RNN accepts a hidden state from\nthe previous unit and itself produces an output as well as a new hidden state.\nRNN RNN RNN\nEncoder\tVector\nRNNRNN\n\x001 \x002 \x003\n\x001\n\x002 \x003\n\x001\x002\nDecoder\nEncoder\nFigure 4: Visualisation of the Sequence to Sequence (seq2seq) Model\nThe Encoder Vector (context) was shown to be a bottleneck for these type of models since it needed\nto contain all all the necessary information of a source sentence in a ﬁxed-length vector which was\nparticularly problematic for long sequences. There have been approaches to solve this problem by', 'Hidden\tLayer\xa0\x00\nInput\xa0\x00\nOutput\xa0\x00\nHidden\tLayer\xa0\x00\x00\nInput\xa0\x00\x00\nOutput\xa0\x00\x00\nFeedforward\tNeural\tNetwork Recurrent\tNeural\tNetwork\n\x00\x00ℎ\n\x00ℎ\x00\n\x00\x00ℎ\n\x00ℎℎ\n\x00ℎ\x00\nFigure 1: Visualisation of differences between Feedfoward NNs und Recurrent NNs\nOt = φo (HtWho + bo) (2)\nSince Ht recursively includes Ht−1 and this process occurs for every time step the RNN includes\ntraces of all hidden states that preceded Ht−1 as well as Ht−1 itself.\nIf we compare that notation for RNNs with similar notation for Feedforward Neural Networks we\ncan clearly see the difference we described earlier. In Equation 3 we can see the computation for the\nhidden variable while Equation 4 shows the output variable.\nH = φh (XWxh + bh) (3)', 'neural network ﬂow in structures called gated cells [6, 12]. To make things work in an LSTM we use\nan output gate Ot to read entries of the cell, an input gate It to read data into the cell and a forget\n3']","Una Recurrent Neural Network (RNN) è un tipo di rete neurale progettata per elaborare dati sequenziali. A differenza delle reti neurali feedforward, le RNN mantengono un ""hidden state"" che viene aggiornato ad ogni passo temporale, permettendo loro di includere informazioni dai passi precedenti nella sequenza. Questo le rende particolarmente adatte per compiti come il riconoscimento vocale, la modellazione del linguaggio, la generazione di testo e la descrizione di immagini [source:Documents\rnn.pdf].",Una RNN è un tipo di rete neurale progettata per elaborare sequenze di dati. Ha connessioni cicliche che le permettono di mantenere informazioni sullo stato precedente.,0.9999999999666667,1.0,1.0,0.8710042177983272
Che cos'è una CNN?,"['Through this simple method of transformation, CNNs are able to transform\nthe original input layer by layer using convolutional and downsampling tech-\nniques to produce class scores for classiﬁcation and regression purposes.\nFig. 3: Activations taken from the ﬁrst convolutional layer of a simplistic deep\nCNN, after training on the MNIST database of handwritten digits. If you look\ncarefully, you can see that the network has successfully picked up on character-\nistics unique to speciﬁc numeric digits.\nHowever, it is important to note that simply understanding the overall archi-\ntecture of a CNN architecture will not sufﬁce. The creation and optimisation', 'et al. Curran Associates, Inc., 2014, pp. 3104–3112.\n[17] Ashish Vaswani et al. “Attention is All you Need”. In: Advances in Neural Information\nProcessing Systems 30. Ed. by I. Guyon et al. Curran Associates, Inc., 2017, pp. 5998–6008.\n[18] S. Venugopalan et al. “Sequence to Sequence – Video to Text”. In:2015 IEEE International\nConference on Computer Vision (ICCV). 2015, pp. 4534–4542.\n[19] Oriol Vinyals, Meire Fortunato, and Navdeep Jaitly. “Pointer Networks”. In: Advances in\nNeural Information Processing Systems 28. Ed. by C. Cortes et al. Curran Associates, Inc.,\n2015, pp. 2692–2700.\n[20] Oriol Vinyals et al. “Grandmaster level in StarCraft II using multi-agent reinforcement learn-', 'Recurrent Neural Networks (RNNs):\nA gentle Introduction and Overview\nRobin M. Schmidt\nDepartment of Computer Science\nEberhard-Karls-University Tübingen\nTübingen, Germany\nrob.schmidt@student.uni-tuebingen.de\nAbstract\nState-of-the-art solutions in the areas of “Language Modelling & Generating Text”,\n“Speech Recognition”, “Generating Image Descriptions” or “Video Tagging” have\nbeen using Recurrent Neural Networks as the foundation for their approaches.\nUnderstanding the underlying concepts is therefore of tremendous importance if\nwe want to keep up with recent or upcoming publications in those areas. In this\nwork we give a short overview over some of the most important concepts in the', '19. Tivive, F.H.C., Bouzerdoum, A.: A new class of convolutional neural networks\n(siconnets) and their application of face detection. In: Neural Networks, 2003. Pro-\nceedings of the International Joint Conference on. vol. 3, pp. 2157–2162. IEEE (2003)\n20. Zeiler, M.D., Fergus, R.: Stochastic pooling for regularization of deep convolutional\nneural networks. arXiv preprint arXiv:1301.3557 (2013)\n21. Zeiler, M.D., Fergus, R.: Visualizing and understanding convolutional networks. In:\nComputer Vision–ECCV 2014, pp. 818–833. Springer (2014)']","Una CNN (Convolutional Neural Network) è una rete neurale che trasforma l'input originale strato per strato utilizzando tecniche di convoluzione e downsampling per produrre punteggi di classificazione e regressione. Queste reti sono in grado di apprendere caratteristiche specifiche dai dati, come mostrato, ad esempio, nell'addestramento su database di cifre scritte a mano come MNIST [source:Documents\cnn.pdf].","Una CNN è un tipo di rete neurale particolarmente efficace per l'elaborazione di dati con una struttura a griglia, come le immagini. Utilizza convoluzioni per estrarre caratteristiche locali.",0.9999999999,1.0,1.0,0.8246917726244966
